"id","parentId","xpathRelative","description","repeatable"
"ND-Organization","ND-Organizations","efac:Organization","A Party involved in the Competition from either side (Buyer or Tenderer) with a Legal Entity (Company) and possibly additional Contact Points (touchpoints)","TRUE"
"ND-Organizations","ND-RootExtension","efac:Organizations","Covers each individual Organization and Ultimate Beneficial Owner","FALSE"
"ND-OrganizationUboReference","ND-Organization","efac:UltimateBeneficialOwner","Organization UBO","TRUE"
"ND-OtherContractExecutionConditions","ND-LotTender","efac:ContractTerm[not(efbc:TermCode/text()='all-rev-tic')][efbc:TermCode/@listName='contract-detail']","Conditions other than Revenue Allocation","TRUE"
"ND-Part","ND-Root","cac:ProcurementProjectLot[cbc:ID/@schemeName='Part']","Part related information covering Tendering Terms, Tendering Process and Purpose","TRUE"
"ND-PartAdditionalClassification","ND-PartProcurementScope","cac:AdditionalCommodityClassification","Classification for an Additional Commodity of a Part","TRUE"
"ND-PartContractAdditionalNature","ND-PartProcurementScope","cac:ProcurementAdditionalType[cbc:ProcurementTypeCode/@listName='contract-nature']","Additional contract nature for the Part","TRUE"
"ND-PartDuration","ND-PartProcurementScope","cac:PlannedPeriod","Duration (Duration, Start and End or Other) for a Part","FALSE"
"ND-PartEmploymentLegislation","ND-PartTenderingTerms","cac:EmploymentLegislationDocumentReference","Identifier, URL and issuer","FALSE"
"ND-PartEnvironmentalLegislation","ND-PartTenderingTerms","cac:EnvironmentalLegislationDocumentReference","Identifier, URL and issuer","FALSE"
"ND-PartFiscalLegislation","ND-PartTenderingTerms","cac:FiscalLegislationDocumentReference","Identifier, URL and issuer","FALSE"
"ND-Participants","ND-LotTenderingTerms","cac:EconomicOperatorShortList","List of Paticipants (Names) to a Design Contest","FALSE"
"ND-ParticipationRequestPeriod","ND-LotTenderingProcess","cac:ParticipationRequestReceptionPeriod","Period to request participation to the Lot competition","FALSE"
"ND-PartInfoRequestPeriod","ND-PartTenderingProcess","cac:AdditionalInformationRequestPeriod","Period to request further information about the given Part","FALSE"
"ND-PartMainClassification","ND-PartProcurementScope","cac:MainCommodityClassification","Classification for the Main Commodity of a Part","FALSE"
"ND-PartPerformanceAddress","ND-PartPlacePerformance","cac:Address","Part Place of Performance address","FALSE"
"ND-PartPlacePerformance","ND-PartProcurementScope","cac:RealizedLocation","A location where the Procurement, for the Part, should take place","TRUE"
"ND-PartPreviousPlanning","ND-PartTenderingProcess","cac:NoticeDocumentReference","Part Previous Planning Reference","TRUE"
"ND-PartProcurementDocument","ND-PartTenderingTerms","cac:CallForTendersDocumentReference","Procurement Document information for a Part, independent from the restricted aspect","TRUE"
"ND-PartProcurementScope","ND-Part","cac:ProcurementProject","Scope of the Procurement addressed with this Part","FALSE"
"ND-PartReservedParticipation","ND-PartTenderingTerms","cac:TendererQualificationRequest[not(cbc:CompanyLegalFormCode)][not(cac:SpecificTendererRequirement/cbc:TendererRequirementTypeCode[@listName='missing-info-submission'])]","Part Information about Reserved Participation","FALSE"
"ND-PartReservedProcurement","ND-PartReservedParticipation","cac:SpecificTendererRequirement[cbc:TendererRequirementTypeCode/@listName='reserved-procurement']","Reserved Procurement","TRUE"
"ND-PartReviewTerms","ND-PartTenderingTerms","cac:AppealTerms","Deadline, Mediator, Information Provider, Recipient","FALSE"
"ND-PartTenderingProcess","ND-Part","cac:TenderingProcess","Tendering Procedure information (GPA, Atypical Tool, Information Deadline) for a Part","FALSE"
"ND-PartTenderingProcessExtension","ND-PartTenderingProcess","ext:UBLExtensions/ext:UBLExtension/ext:ExtensionContent/efext:EformsExtension","UBL non native elements in Part Tendering Process (e.g. atypical  Access Tool)","FALSE"
"ND-PartTenderingTerms","ND-Part","cac:TenderingTerms","Submission, validity, Recipient, Information and Document Providers …","FALSE"
"ND-PartValueEstimate","ND-PartProcurementScope","cac:RequestedTenderTotal","Part Overall Value Estimate (Amount and Currency)","FALSE"
"ND-PayerParty","ND-LotResult","cac:PayerParty","Payer party","TRUE"
"ND-PaymentTerms","ND-LotTenderingTerms","cac:PaymentTerms","Financing and Payment information","FALSE"
"ND-PMCAnswersDeadline","ND-LotTenderingProcessExtension","efac:AnswerReceptionPeriod","Deadline for reception of answers to the PMC","FALSE"
"ND-PostAwarProcess","ND-LotTenderingTerms","cac:PostAwardProcess","Processes (eOrdering, ePayment) involved in contract execution","FALSE"
"ND-PreselectedParticipant","ND-Participants","cac:PreSelectedParty","Preselected party","TRUE"
"ND-PreviousNoticeReference","ND-ProcedureTenderingProcess","cac:NoticeDocumentReference","Previous notice reference","TRUE"
"ND-Prize","ND-AwardingTerms","cac:Prize","Prize related information","TRUE"
"ND-ProcedureAcceleratedJustificationUnpublish","ND-AcceleratedProcedure","ext:UBLExtensions/ext:UBLExtension/ext:ExtensionContent/efext:EformsExtension/efac:FieldsPrivacy[efbc:FieldIdentifierCode/text()='pro-acc-jus']","Not Immediately Published (ProcedureAcceleratedJustification)","FALSE"
"ND-ProcedureAcceleratedUnpublish","ND-AcceleratedProcedure","ext:UBLExtensions/ext:UBLExtension/ext:ExtensionContent/efext:EformsExtension/efac:FieldsPrivacy[efbc:FieldIdentifierCode/text()='pro-acc']","Not Immediately Published (Procedure Accelerated)","FALSE"
"ND-ProcedureAdditionalCommodityClassification","ND-ProcedureProcurementScope","cac:AdditionalCommodityClassification","Classification for the Additional Commodity of the Procedure","TRUE"
"ND-ProcedureContractAdditionalNature","ND-ProcedureProcurementScope","cac:ProcurementAdditionalType[cbc:ProcurementTypeCode/@listName='contract-nature']","Additional contract nature for the Procedure","TRUE"
"ND-ProcedureFeaturesUnpublish","ND-ProcedureTenderingProcess","ext:UBLExtensions/ext:UBLExtension/ext:ExtensionContent/efext:EformsExtension/efac:FieldsPrivacy[efbc:FieldIdentifierCode/text()='pro-fea']","Not Immediately Published (ProcedureFeatures)","FALSE"
"ND-ProcedureMainClassification","ND-ProcedureProcurementScope","cac:MainCommodityClassification","Classification for the Main Commodity of the Procedure","FALSE"
"ND-ProcedurePlacePerformance","ND-ProcedurePlacePerformanceAdditionalInformation","cac:Address","A location where the Procurement, for the Procedure as a whole, should take place","FALSE"
"ND-ProcedurePlacePerformanceAdditionalInformation","ND-ProcedureProcurementScope","cac:RealizedLocation","Additional Information about the location where the Procurement, for the Procedure as a whole, should take place","TRUE"
"ND-ProcedureProcurementScope","ND-Root","cac:ProcurementProject","Scope of the Procurement addressed with the whole notice","FALSE"
"ND-ProcedureTenderingProcess","ND-Root","cac:TenderingProcess","Properties (Type, Relaunch, Termination, tendering for all lots) of the Tendering Process of the Procurement Procedure as a whole","FALSE"
"ND-ProcedureTerms","ND-Root","cac:TenderingTerms","Tendering Terms for the Procedure as a whole.","FALSE"
"ND-ProcedureTransportServiceType","ND-ProcedureProcurementScope","cac:ProcurementAdditionalType[cbc:ProcurementTypeCode/@listName='transport-service']","Transport service type","TRUE"
"ND-ProcedureTypeUnpublish","ND-ProcedureTenderingProcess","ext:UBLExtensions/ext:UBLExtension/ext:ExtensionContent/efext:EformsExtension/efac:FieldsPrivacy[efbc:FieldIdentifierCode/text()='pro-typ']","Not Immediately Published (Procedure Type)","FALSE"
"ND-ProcedureValueEstimate","ND-ProcedureProcurementScope","cac:RequestedTenderTotal","Initial estimation and framework maximum values for the whole procedure","FALSE"
"ND-ProcedureValueEstimateExtension","ND-ProcedureValueEstimate","ext:UBLExtensions/ext:UBLExtension/ext:ExtensionContent/efext:EformsExtension","Non UBL native elements at Procedure Requested Tender Total level","FALSE"
"ND-ProcurementDetailsLotResult","ND-StrategicProcurementInformationLotResult","efac:ProcurementDetails","Information about the assets: category and quantity (number) in the context of an applicable Legal Basis","TRUE"
"ND-ProcurementStatistics","ND-ProcurementDetailsLotResult","efac:StrategicProcurementStatistics","Numbers about the procurement: category (code) and quantity (number)","TRUE"
"ND-ProviderParty","ND-ServiceProviderParty","cac:Party","Provider Party","FALSE"
"ND-Publication","ND-RootExtension","efac:Publication","Publication metadata","FALSE"
"ND-PublicOpening","ND-LotTenderingProcess","cac:OpenTenderEvent","Public Opening of Tenders (Date, Time, Location)","FALSE"
"ND-PublicOpeningPlace","ND-PublicOpening","cac:OccurenceLocation","Information the location of the opening event","FALSE"
"ND-QualityTarget","ND-LotTenderingTerms","cac:ContractExecutionRequirement[cbc:ExecutionRequirementCode/@listName='customer-service']","Information (Description) about a given Quality Target","TRUE"
"ND-ReceivedSubmissionCountUnpublish","ND-ReceivedSubmissions","efac:FieldsPrivacy[efbc:FieldIdentifierCode/text()='rec-sub-cou']","Not Immediately Published (ReceivedSubmissionCount)","FALSE"
"ND-ReceivedSubmissions","ND-LotResult","efac:ReceivedSubmissionsStatistics","Container for Received Submissions Statististics Numeric value and associated code.","TRUE"
"ND-ReceivedSubmissionTypeUnpublish","ND-ReceivedSubmissions","efac:FieldsPrivacy[efbc:FieldIdentifierCode/text()='rec-sub-typ']","Not Immediately Published (ReceivedSubmissionType)","FALSE"
"ND-ReestimatedValueUnpublish","ND-LotResultFAValues","efac:FieldsPrivacy[efbc:FieldIdentifierCode/text()='ree-val']","Not Immediately Published (ReestimatedValue)","FALSE"
"ND-RegistrarAddress","ND-EuEntity","cac:CorporateRegistrationScheme/cac:JurisdictionRegionAddress","Address of the Registrar that processed the operation","FALSE"
"ND-ReservedExecution","ND-LotTenderingTerms","cac:ContractExecutionRequirement[cbc:ExecutionRequirementCode/@listName='reserved-execution']","Information (Justification) on the Reserved Execution","FALSE"
"ND-RevenueAllocation","ND-LotTender","efac:ContractTerm[efbc:TermCode/text()='all-rev-tic']","Revenue allocation in percentage","FALSE"
"ND-RevewRequestsUnpublish","ND-BuyerReviewComplainants","efac:FieldsPrivacy[efbc:FieldIdentifierCode/text()='rev-req']","Not Immediately Published (RevewRequests)","FALSE"
"ND-ReviewPresentationPeriod","ND-LotReviewTerms","cac:PresentationPeriod","Information about the Review presentation period","FALSE"
"ND-ReviewRequests","ND-RootExtension","efac:AppealsInformation","Information about Requested Reviews and their associated statuses","TRUE"
"ND-ReviewRequestsStatistics","ND-LotResult","efac:AppealRequestsStatistics[efbc:StatisticsCode/@listName='irregularity-type']","Statistics about Review Requests (number and code)","TRUE"
"ND-ReviewRequestsStatisticsCountUnpublish","ND-ReviewRequestsStatistics","efac:FieldsPrivacy[efbc:FieldIdentifierCode/text()='buy-rev-cou']","Not Immediately Published (RevewRequests irregularity count )","FALSE"
"ND-ReviewRequestsStatisticsTypeUnpublish","ND-ReviewRequestsStatistics","efac:FieldsPrivacy[efbc:FieldIdentifierCode/text()='buy-rev-typ']","Not Immediately Published (RevewRequests irregularity type )","FALSE"
"ND-ReviewStatus","ND-ReviewRequests","efac:AppealStatus","Status of submitted Review Requests (ID, Stage, Title, Description, Request, Decision)","TRUE"
"ND-RewardsPenalties","ND-LotTender","efac:ContractTerm[efbc:TermCode/@listName='rewards-penalties']","Information (Description) about applicable Rewards or Penalties","FALSE"
"ND-Root","NULL","/*","XML document root","FALSE"
"ND-RootExtension","ND-Root","ext:UBLExtensions/ext:UBLExtension/ext:ExtensionContent/efext:EformsExtension","Non UBL native elements at document's root","FALSE"
"ND-SecondStage","ND-LotTenderingProcess","cac:EconomicOperatorShortList","Secon Stage related information (Min & Max Candidates)","FALSE"
"ND-SecondStageCriterionParameter","ND-SelectionCriteria","efac:CriterionParameter","Parameter (Number & Code) for a Second Stage Criterion","TRUE"
"ND-SecurityClearanceTerms","ND-LotTenderingTerms","cac:SecurityClearanceTerm","Terms for Security Clearance (Code & Description)","FALSE"
"ND-SelectionCriteria","ND-NonUBLTenderingTerms","efac:SelectionCriteria","Selection Criteria including the ones for 2nd stage (Type, Name, Description, Use, Parameters)","TRUE"
"ND-SenderContact","ND-Root","cac:SenderParty/cac:Contact","Contact Details (email) of the person dealing with the information submission","FALSE"
"ND-ServiceProvider","ND-ContractingParty","cac:Party","Party (Reference to Organization) that is Providing Services","FALSE"
"ND-ServiceProviderParty","ND-ServiceProvider","cac:ServiceProviderParty","Provided Service (code) and Provider (Reference to Organization)","TRUE"
"ND-SettledContract","ND-NoticeResult","efac:SettledContract","Contract settled (or about to be settled) between a Contracting Party and a Tendering Party to satisfy the requirements expressed as part of the Procurement Procedure","TRUE"
"ND-SettledContractTenderReference","ND-SettledContract","efac:LotTender","Tender leading to the contract","TRUE"
"ND-StrategicProcurementInformationLot","ND-StrategicProcurementLot","efac:StrategicProcurementInformation","Information about the foreseen strategic procurement and associated assets: categories (Procurement, assets ...) in the context of an applicable Legal Basis","TRUE"
"ND-StrategicProcurementInformationLotResult","ND-StrategicProcurementLotResult","efac:StrategicProcurementInformation","Information about the strategic procurement and associated assets: categories (Procurement, assets ...) and quantity (number) in the context of an applicable Legal Basis","TRUE"
"ND-StrategicProcurementLot","ND-NonUBLTenderingTerms","efac:StrategicProcurement","Information about the foreseen strategic procurement and associated assets: categories (Procurement, assets ...)","FALSE"
"ND-StrategicProcurementLotResult","ND-LotResult","efac:StrategicProcurement","Overall information about the strategic procurement and associated assets: categories (Procurement, assets ...) and quantity (number)","FALSE"
"ND-StrategicProcurementType","ND-LotProcurementScope","cac:ProcurementAdditionalType[cbc:ProcurementTypeCode/@listName='strategic-procurement']","Information (Description) about Strategic Procurement Type","TRUE"
"ND-SubcontractedActivity","ND-LotTender","efac:SubcontractingTerm","Whether part of the Contract is subcontracted or not, and Subcontracted Quantity.","FALSE"
"ND-SubcontractedContract","ND-LotTender","efac:SubcontractingTerm[efbc:TermCode/@listName='applicability']","Whether the Contract will be subcontracted and subcontracted portion","FALSE"
"ND-SubcontractingDescriptionUnpublish","ND-SubcontractedActivity","efac:FieldsPrivacy[efbc:FieldIdentifierCode/text()='sub-des']","Not Immediately Published (SubcontractingDescription)","FALSE"
"ND-SubcontractingIndication","ND-NonUBLTenderingTerms","efac:TenderSubcontractingRequirements","Tender subcontracting indication","TRUE"
"ND-SubcontractingObligation","ND-LotTenderingTerms","cac:AllowedSubcontractTerms[cbc:SubcontractingConditionsCode/@listName='subcontracting-obligation']","Obligation associated to Subcontracting","FALSE"
"ND-SubcontractingPercentageKnownUnpublish","ND-SubcontractedActivity","efac:FieldsPrivacy[efbc:FieldIdentifierCode/text()='sub-per-kno']","Not Immediately Published (SubcontractingPercentageKnown)","FALSE"
"ND-SubcontractingPercentageUnpublish","ND-SubcontractedActivity","efac:FieldsPrivacy[efbc:FieldIdentifierCode/text()='sub-per']","Not Immediately Published (SubcontractingPercentage)","FALSE"
"ND-SubcontractingUnpublish","ND-SubcontractedActivity","efac:FieldsPrivacy[efbc:FieldIdentifierCode/text()='sub-con']","Not Immediately Published (Subcontracting)","FALSE"
"ND-SubcontractingValueKnownUnpublish","ND-SubcontractedActivity","efac:FieldsPrivacy[efbc:FieldIdentifierCode/text()='sub-val-kno']","Not Immediately Published (SubcontractingValueKnown)","FALSE"
"ND-SubcontractingValueUnpublish","ND-SubcontractedActivity","efac:FieldsPrivacy[efbc:FieldIdentifierCode/text()='sub-val']","Not Immediately Published (SubcontractingValue)","FALSE"
"ND-SubContractor","ND-TenderingParty","efac:SubContractor","Organization identified as a contractor of one at least of the Main Tenderers of a Tendering Party","TRUE"
"ND-SubContractorTakerReference","ND-SubContractor","efac:MainContractor","Subcontractor taker","TRUE"
"ND-SubcontractTerms","ND-LotTenderingTerms","cac:AllowedSubcontractTerms","Mandatory Terms for Subcontracting","TRUE"
"ND-SubmissionDeadline","ND-LotTenderingProcess","cac:TenderSubmissionDeadlinePeriod","Submission Deadline for the given lot","FALSE"
"ND-TenderAggregatedAmounts","ND-LotTender","efac:AggregatedAmounts","Aggregated amounts for all the execution contracts of the given tender until project end.","FALSE"
"ND-Tenderer","ND-TenderingParty","efac:Tenderer","One of the member of the Tendring Party","TRUE"
"ND-TendererLegalForm","ND-LotTenderingTerms","cac:TendererQualificationRequest[not(cac:SpecificTendererRequirement)]","Tenderer Legal Form","FALSE"
"ND-TendererQualificationRequest","ND-ProcedureTerms","cac:TendererQualificationRequest","Container for Exclusion Grounds","FALSE"
"ND-TenderingParty","ND-NoticeResult","efac:TenderingParty","Party formed of one or more organizations than jointly submitted a Tender","TRUE"
"ND-TenderRankUnpublish","ND-LotTender","efac:FieldsPrivacy[efbc:FieldIdentifierCode/text()='ten-ran']","Not Immediately Published (TenderRank)","FALSE"
"ND-TenderRecipient","ND-LotTenderingTerms","cac:TenderRecipientParty","ND-TenderRecipient","FALSE"
"ND-TenderValueHighestUnpublish","ND-LotResult","efac:FieldsPrivacy[efbc:FieldIdentifierCode/text()='ten-val-hig']","Not Immediately Published (TenderValueHighest)","FALSE"
"ND-TenderValueLowestUnpublish","ND-LotResult","efac:FieldsPrivacy[efbc:FieldIdentifierCode/text()='ten-val-low']","Not Immediately Published (TenderValueLowest)","FALSE"
"ND-Touchpoint","ND-Organization","efac:TouchPoint","Contact details associated to a given role","TRUE"
"ND-TouchpointAddress","ND-Touchpoint","cac:PostalAddress","Touchpoint address","FALSE"
"ND-TouchpointContact","ND-Touchpoint","cac:Contact","Touchpoint contact","FALSE"
"ND-UBO","ND-Organizations","efac:UltimateBeneficialOwner","Ultimate Beneficial Owner","TRUE"
"ND-UBOAddress","ND-UBO","cac:ResidenceAddress","UBO address","FALSE"
"ND-UBOContact","ND-UBO","cac:Contact","UBO contact","FALSE"
"ND-UBONationality","ND-UBO","efac:Nationality","UBO nationality","TRUE"
"ND-ValueConcessionDescriptionUnpublish","ND-ConcessionRevenue","efac:FieldsPrivacy[efbc:FieldIdentifierCode/text()='val-con-des']","Not Immediately Published (ValueConcessionDescription)","FALSE"
"ND-WinnerChosenUnpublish","ND-LotResult","efac:FieldsPrivacy[efbc:FieldIdentifierCode/text()='win-cho']","Not Immediately Published (WinnerChosen)","FALSE"
"ND-WinningTenderValueUnpublish","ND-LotTender","efac:FieldsPrivacy[efbc:FieldIdentifierCode/text()='win-ten-val']","Not Immediately Published (WinningTenderValue)","FALSE"
"ND-WinningTenderVariantUnpublish","ND-LotTender","efac:FieldsPrivacy[efbc:FieldIdentifierCode/text()='win-ten-var']","Not Immediately Published (WinningTenderVariant)","FALSE"
